q_id,topic_id,question_text,option_A,option_B,option_C,option_D,correct_option,difficulty,source
K6E1_01,k6_e1_find_replace,Công cụ nào trong phần mềm soạn thảo giúp tìm nhanh cụm từ trong văn bản?,Replace,Find,Print,Layout,B,Nhận biết,Chủ đề E – Bài 1
K6E1_02,k6_e1_find_replace,Công cụ Replace dùng để làm gì?,Chèn bảng,Thay thế một cụm từ bằng cụm từ khác,Tạo trang mới,In toàn bộ tài liệu,B,Nhận biết,Chủ đề E – Bài 1
K6E1_03,k6_e1_find_replace,Lệnh Find thường nằm ở dải lệnh nào?,Insert,Home,Page Layout,Review,B,Nhận biết,Chủ đề E – Bài 1
K6E1_04,k6_e1_find_replace,Hộp thoại hỗ trợ Tìm và Thay thế thường có tên là:,Format,Page Setup,Find and Replace,Print Preview,C,Nhận biết,Chủ đề E – Bài 1
K6E1_05,k6_e1_find_replace,Nút nào dùng để thay tất cả các vị trí tìm thấy một lần?,Find Next,Replace,Replace All,Close,C,Nhận biết,Chủ đề E – Bài 1
K6E1_06,k6_e1_find_replace,Vùng Navigation khi tìm kiếm hiển thị:,Thanh công cụ vẽ,Danh sách kết quả và nút điều hướng,Khung in,Thanh trạng thái,B,Nhận biết,Chủ đề E – Bài 1
K6E1_07,k6_e1_find_replace,Vì sao công cụ Find hữu ích với văn bản dài?,Giúp thay đổi phông chữ,Giúp định vị nhanh cụm từ ở nhiều vị trí,Giúp chèn hình ảnh,Giúp tăng tốc máy,B,Thông hiểu,Chủ đề E – Bài 1
K6E1_08,k6_e1_find_replace,Khi cần xem từng chỗ rồi mới quyết định thay, ta nên dùng:,Replace All,Find Next kết hợp Replace,Print,Save,B,Thông hiểu,Chủ đề E – Bài 1
K6E1_09,k6_e1_find_replace,Điểm khác giữa Replace và Replace All là:,Cùng chức năng hoàn toàn,Replace thay từng chỗ; Replace All thay tất cả,Replace chỉ đếm,Replace All chỉ tìm,B,Thông hiểu,Chủ đề E – Bài 1
K6E1_10,k6_e1_find_replace,Để đếm số lần xuất hiện của một dấu/chữ, ta có thể:,In văn bản,Cuộn tay từng trang,Dùng Find để xem số kết quả,Dùng Thesaurus,C,Thông hiểu,Chủ đề E – Bài 1
K6E1_11,k6_e1_find_replace,Tình huống: cần đổi “bạn” thành “cậu” trong cả thư. Cách nhanh nhất là:,Sửa tay từng chỗ,Find → Replace All,In ra rồi gạch sửa,Lưu tên khác,B,Vận dụng,Chủ đề E – Bài 1
K6E1_12,k6_e1_find_replace,Cần quan sát và chỉ thay một số chỗ nhất định. Bạn chọn:,Replace All ngay,Lặp lại Find Next và dùng Replace khi phù hợp,Mở ứng dụng khác,Đổi màu nền,B,Vận dụng,Chủ đề E – Bài 1
K6E2_01,k6_e2_page_setup_print,Định dạng đoạn KHÔNG bao gồm thuộc tính nào sau đây?,Căn lề (Align),Dãn dòng (Line spacing),Dãn đoạn (Space before/after),Kích thước giấy,A,Nhận biết,Chủ đề E – Bài 2
K6E2_02,k6_e2_page_setup_print,Định dạng trang xử lí các thuộc tính:,Phông chữ,Canh lề trái/phải/trên/dưới,Kiểu gạch chân,Màu chữ,B,Nhận biết,Chủ đề E – Bài 2
K6E2_03,k6_e2_page_setup_print,Nút lệnh mở vùng in thường nằm ở:,File → Print,Home → Clipboard,Insert → Shapes,View → Zoom,A,Nhận biết,Chủ đề E – Bài 2
K6E2_04,k6_e2_page_setup_print,Thao tác nào để chọn mẫu lề nhanh?,Page Layout → Margins,Home → Styles,Insert → Table,Review → Spelling,A,Nhận biết,Chủ đề E – Bài 2
K6E2_05,k6_e2_page_setup_print,Chế độ xem trước khi in giúp:,Chỉnh chính tả,Kiểm tra bố cục/trang trước khi in,Thêm hình nền,Gửi email,B,Nhận biết,Chủ đề E – Bài 2
K6E2_06,k6_e2_page_setup_print,Để in một phạm vi trang nhất định, ta cần:,Chỉ nháy Print ngay,Chọn máy in và nhập số bản,Chọn Range/Pages phù hợp,Chọn Replace All,C,Nhận biết,Chủ đề E – Bài 2
K6E2_07,k6_e2_page_setup_print,Vì sao cần dãn dòng hợp lí?,Để văn bản dễ đọc và thoáng mắt,Để in nhanh hơn,Để đổi màu giấy,Để giảm dung lượng,A,Thông hiểu,Chủ đề E – Bài 2
K6E2_08,k6_e2_page_setup_print,Ưu điểm của căn biên đều 2 bên (Justify) là:,Giảm số chữ,Giúp văn bản thẳng mép, gọn gàng,Dễ gõ hơn,Tự động dịch thuật,B,Thông hiểu,Chủ đề E – Bài 2
K6E2_09,k6_e2_page_setup_print,Sự khác nhau cơ bản giữa định dạng đoạn và định dạng trang:,Đoạn áp dụng cho khối văn bản; trang áp dụng cho toàn trang,Trang chỉ đổi màu,Đoạn chỉ đổi phông,Không khác nhau,A,Thông hiểu,Chủ đề E – Bài 2
K6E2_10,k6_e2_page_setup_print,Chọn Orientation (Portrait/Landscape) nhằm mục đích:,Đổi phông,Đổi hướng giấy dọc/ngang,Đổi mật khẩu,Đổi chủ đề,B,Thông hiểu,Chủ đề E – Bài 2
K6E2_11,k6_e2_page_setup_print,Văn bản lộn xộn, khó đọc. Thao tác nhanh để cải thiện:,Tăng zoom 500%,Căn đều hai bên, đặt line spacing 1.15–1.5,Chọn Replace All,Dán nhiều hình,B,Vận dụng,Chủ đề E – Bài 2
K6E2_12,k6_e2_page_setup_print,Cần in 2 bản từ trang 3 đến 5. Thiết lập hợp lí là:,Print All,Pages: 3-5; Copies: 2,Only current page,Fit to One Page,B,Vận dụng,Chủ đề E – Bài 2
K6E3_01,k6_e3_practice_wp,Trong bài thực hành tổng hợp về văn bản, yêu cầu chung là:,Chỉ gõ chữ,Định dạng phông/đoạn, căn lề trang và in,Chỉ chèn hình,Chỉ kiểm tra chính tả,B,Nhận biết,Chủ đề E – Bài 3
K6E3_02,k6_e3_practice_wp,Công cụ nào giúp đếm nhanh số lần xuất hiện của từ trong thực hành?,Thesaurus,Find,Track Changes,Drawing,B,Nhận biết,Chủ đề E – Bài 3
K6E3_03,k6_e3_practice_wp,Để thay “Tý” bằng “bạn Tý” trong thực hành, ta dùng:,Find → Replace All,Insert → Picture,Review → New Comment,View → Ruler,A,Nhận biết,Chủ đề E – Bài 3
K6E3_04,k6_e3_practice_wp,Chọn lề trang mẫu “Normal” thường thiết lập:,Lề 1cm,Lề 2.54cm,Lề 3.5cm,Không có lề,B,Nhận biết,Chủ đề E – Bài 3
K6E3_05,k6_e3_practice_wp,Khi in văn bản trong thực hành, cần kiểm tra:,Số bản, máy in, phạm vi in,Tên phông Máy in,Tài khoản email,Trang web,B,Nhận biết,Chủ đề E – Bài 3
K6E3_06,k6_e3_practice_wp,Tên tệp lưu sản phẩm nên:,New Document,Không cần đặt tên,Theo yêu cầu bài (ví dụ: “Chuyến tham quan đáng nhớ”),Tên bất kì,C,Nhận biết,Chủ đề E – Bài 3
K6E3_07,k6_e3_practice_wp,Lí do dùng Track Changes KHÔNG phù hợp với mục tiêu bài là:,Theo dõi chỉnh sửa,Chấm bài,Thay thế từ nhanh,Trao đổi góp ý,C,Thông hiểu,Chủ đề E – Bài 3
K6E3_08,k6_e3_practice_wp,Vì sao cần thao tác chậm – giải thích bước khi trình diễn trên lớp?,Để bạn học theo kịp quy trình,Để máy không treo,Để tạo hiệu ứng,Để tiết kiệm mực,A,Thông hiểu,Chủ đề E – Bài 3
K6E3_09,k6_e3_practice_wp,Khi cần định dạng các từ khóa nổi bật, thao tác phù hợp là:,Đổi trang,In đậm/ghi chân từ khóa,In ngay,Chỉ thay phông hệ thống,B,Thông hiểu,Chủ đề E – Bài 3
K6E3_10,k6_e3_practice_wp,Bước hợp lí sau khi hoàn thành thay thế toàn bộ là:,Đóng máy ngay,Lưu tệp để ghi nhận thay đổi,Đổi hệ điều hành,Chia sẻ công khai,B,Thông hiểu,Chủ đề E – Bài 3
K6E3_11,k6_e3_practice_wp,Thực hành: tìm tất cả dấu “,” và thay “;”. Trình tự đúng là:,Print → Replace,Replace → Find Next → Replace/Replace All,Insert → Replace,Home → Print,B,Vận dụng,Chủ đề E – Bài 3
K6E3_12,k6_e3_practice_wp,Muốn đánh giá bạn làm đúng – đẹp – nhanh, tiêu chí phù hợp là:,Chỉ tốc độ,Chỉ nhiều hình,Đúng yêu cầu – bố cục đẹp – đúng thao tác,Báo cáo miệng,D,Vận dụng,Chủ đề E – Bài 3
K6E4_01,k6_e4_tables,Trình bày thông tin dưới dạng bảng có tác dụng:,Khó nhìn hơn,Giúp so sánh, hệ thống hóa thông tin,Giảm chất lượng,Không in được,B,Nhận biết,Chủ đề E – Bài 4
K6E4_02,k6_e4_tables,Để chèn bảng nhanh, ta dùng:,Insert → Table,Home → Styles,View → Zoom,Review → Spelling,A,Nhận biết,Chủ đề E – Bài 4
K6E4_03,k6_e4_tables,Độ rộng cột được thay đổi bằng cách:,Đổi phông,Đưa chuột vào biên cột đến khi hiện mũi tên 2 chiều rồi kéo,In đậm,Chọn Replace,B,Nhận biết,Chủ đề E – Bài 4
K6E4_04,k6_e4_tables,Nhóm lệnh để chèn/xóa hàng cột thuộc:,Page Layout,Table Tools → Layout → Rows & Columns,Home → Font,Insert → Shapes,B,Nhận biết,Chủ đề E – Bài 4
K6E4_05,k6_e4_tables,Để thêm một cột bên trái cột đang chọn, dùng lệnh:,Insert Right,Insert Above,Insert Left,Insert Below,C,Nhận biết,Chủ đề E – Bài 4
K6E4_06,k6_e4_tables,Chọn toàn bộ bảng nhanh bằng cách:,Kéo chuột phủ hết,Nháy biểu tượng chọn ở góc trên trái của bảng,Dùng Replace,Nhấn Print,B,Nhận biết,Chủ đề E – Bài 4
K6E4_07,k6_e4_tables,Vì sao phải điều chỉnh độ rộng cột/độ cao hàng?,Để trang trí,Rỗng nội dung,Phù hợp nội dung, dễ đọc,Để đổi định dạng tệp,C,Thông hiểu,Chủ đề E – Bài 4
K6E4_08,k6_e4_tables,Lí do nên dùng bảng cho thời khóa biểu là:,Khó chỉnh sửa,Dễ nhìn, theo hàng/cột, tránh trùng lặp,Không thể in,Không căn lề được,B,Thông hiểu,Chủ đề E – Bài 4
K6E4_09,k6_e4_tables,Sau khi chèn bảng, thao tác nào giúp bảng rõ ràng hơn?,Ẩn đường kẻ,Nhập dữ liệu và căn giữa/căn trái hợp lí,Chỉ đổi nền,Chỉ đổi font,B,Thông hiểu,Chủ đề E – Bài 4
K6E4_10,k6_e4_tables,Vị trí xuất hiện của nhóm Table Tools là khi:,Đặt con trỏ trong bảng,Đặt con trỏ ngoài bảng,Đang in,Đang thay thế,A,Thông hiểu,Chủ đề E – Bài 4
K6E4_11,k6_e4_tables,Thêm cột “Giới tính” trước “Cân nặng”, bước đúng là:,Chọn cột “Cân nặng” → Insert Left,Chọn hàng 1 → Insert Above,Chọn bảng → Delete,Find → Replace,A,Vận dụng,Chủ đề E – Bài 4
K6E4_12,k6_e4_tables,Cần xóa hàng thứ 3 trong bảng BMI. Thao tác:,Chọn hàng 3 → Layout → Delete → Delete Rows,Find → Delete All,Insert → Shapes,Review → Track Changes,A,Vận dụng,Chủ đề E – Bài 4
K6E5_01,k6_e5_practice_overall,Trong bài thực hành tổng hợp soạn thảo, sản phẩm điển hình là:,Đơn xin phép nghỉ học,Trang web,Đồ họa 3D,Video,A,Nhận biết,Chủ đề E – Bài 5
K6E5_02,k6_e5_practice_overall,Trước khi soạn thảo, nên:,Mở tệp mới và đặt tên theo yêu cầu,Chèn ảnh ngay,In trước,Không lưu,A,Nhận biết,Chủ đề E – Bài 5
K6E5_03,k6_e5_practice_overall,Trong yêu cầu thực hành, cỡ chữ/phông thường là:,Arial 8,Time New Roman 13,Tahoma 20,Comic Sans 14,B,Nhận biết,Chủ đề E – Bài 5
K6E5_04,k6_e5_practice_overall,Định dạng đoạn phù hợp với đơn là:,Căn giữa toàn bộ,Căn đều hai bên, dãn dòng 1.5,Không dãn dòng,Chỉ căn trái,B,Nhận biết,Chủ đề E – Bài 5
K6E5_05,k6_e5_practice_overall,Sau khi hoàn thành, nên:,Không lưu,Lưu đúng thư mục – xem trước khi in,Chia sẻ công khai,Đổi định dạng tệp,B,Nhận biết,Chủ đề E – Bài 5
K6E5_06,k6_e5_practice_overall,Chức năng đặc trưng KHÔNG thuộc trình bày trang là:,Căn lề,Khổ giấy,Chọn số bản in,Tìm & Thay thế,D,Nhận biết,Chủ đề E – Bài 5
K6E5_07,k6_e5_practice_overall,Vì sao nên theo mẫu sản phẩm đích khi thực hành?,Để sản phẩm sát yêu cầu, tiết kiệm thời gian,Để nhiều màu,Để khỏi in,Để tránh lưu,B,A,Thông hiểu,Chủ đề E – Bài 5
K6E5_08,k6_e5_practice_overall,Sắp xếp công việc nhóm hiệu quả là:,Một người làm hết,Phân vai: gõ – định dạng – soát – in,Không cần phân công,Chỉ một người xem,B,Thông hiểu,Chủ đề E – Bài 5
K6E5_09,k6_e5_practice_overall,Tiêu chí chấm chéo giữa các nhóm nên dựa vào:,Màu nền,Đúng yêu cầu, trình bày đẹp, thời gian hợp lí,Số ảnh chèn,Âm nhạc nền,B,Thông hiểu,Chủ đề E – Bài 5
K6E5_10,k6_e5_practice_overall,Khi văn bản có lỗi chính tả lặp lại, bước hợp lí là:,Replace All mù quáng,Soát lại, Find và thay chọn lọc,In ngay,Đổi chủ đề,B,Thông hiểu,Chủ đề E – Bài 5
K6E5_11,k6_e5_practice_overall,Thực hành: xác định lề A4 chuẩn nhanh:,File → Print,Page Layout → Margins → Normal,Insert → Page Number,Home → Paragraph,B,Vận dụng,Chủ đề E – Bài 5
K6E5_12,k6_e5_practice_overall,Nhóm cần nộp file và bản in. Trình tự hợp lí:,In trước rồi sửa,Lưu → xem trước (Print Preview) → in → nộp,Chia sẻ link rồi xoá,Chỉ gửi ảnh màn hình,B,Vận dụng,Chủ đề E – Bài 5
K6E6_01,k6_e6_mindmap_basic,Sơ đồ tư duy là:,Bản đồ địa lí,Sơ đồ triển khai ý tưởng ngắn gọn, trực quan,Ảnh phong cảnh,Bảng tính,C,Nhận biết,Chủ đề E – Bài 6
K6E6_02,k6_e6_mindmap_basic,Thành phần cơ bản của sơ đồ tư duy gồm:,Chỉ ảnh,Chủ đề trung tâm, các chủ đề chính, các nhánh nối,Chỉ văn bản dài,Chỉ đường tròn,B,Nhận biết,Chủ đề E – Bài 6
K6E6_03,k6_e6_mindmap_basic,Lợi ích của sơ đồ tư duy là:,Khó nhìn hơn,Giúp tóm tắt/ hệ thống ý, hỗ trợ ghi nhớ/ trình bày,Chỉ dùng cho mỹ thuật,Không áp dụng học tập,B,Nhận biết,Chủ đề E – Bài 6
K6E6_04,k6_e6_mindmap_basic,Các bước chính lập sơ đồ tư duy:,Vẽ ảnh → in,Chọn chủ đề trung tâm → triển khai chủ đề con → bổ sung nhánh,Đổi màu máy,Tắt máy,B,Nhận biết,Chủ đề E – Bài 6
K6E6_05,k6_e6_mindmap_basic,Khi lập sơ đồ, nên ghi:,Đoạn văn dài,Ngắn gọn, từ khóa,Chỉ ký hiệu lạ,Không ghi gì,B,Nhận biết,Chủ đề E – Bài 6
K6E6_06,k6_e6_mindmap_basic,Khoảng trống trong sơ đồ giúp:,Trang trí,Chèn thêm/ mở rộng ý sau này,Tăng dung lượng,Giảm độ tương phản,B,Nhận biết,Chủ đề E – Bài 6
K6E6_07,k6_e6_mindmap_basic,Liên hệ “kế hoạch hè”: “Ôn tập” là chủ đề con của:,Thể thao,Kế hoạch hè,Ẩm thực,Địa lí,B,Thông hiểu,Chủ đề E – Bài 6
K6E6_08,k6_e6_mindmap_basic,Khi “Ôn tập” là chủ đề mẹ, chủ đề con phù hợp là:,Thời khóa biểu,Tiếng Anh, Toán,Ăn trưa,Phòng trực nhật,B,Thông hiểu,Chủ đề E – Bài 6
K6E6_09,k6_e6_mindmap_basic,Chọn phát biểu đúng:,Sơ đồ tư duy luôn là bản đồ địa lí,Sơ đồ tư duy phản ánh suy nghĩ/ý chính theo cấu trúc nhánh,Sơ đồ tư duy không cần chủ đề,Không có lợi ích học tập,B,Thông hiểu,Chủ đề E – Bài 6
K6E6_10,k6_e6_mindmap_basic,Vì sao sơ đồ tư duy giúp trình bày thuyết phục hơn?,Vì dài hơn,Do trực quan, mạch lạc, dễ theo dõi mối liên hệ,Do nhiều màu ngẫu nhiên,Do có nhạc nền,B,Thông hiểu,Chủ đề E – Bài 6
K6E6_11,k6_e6_mindmap_basic,Yêu cầu: tóm tắt bài “Mạng máy tính” bằng sơ đồ tư duy. Bước đầu là:,Vẽ nhánh con trước,Đặt chủ đề trung tâm,Đặt màu nền,In ngay,B,Vận dụng,Chủ đề E – Bài 6
K6E6_12,k6_e6_mindmap_basic,Khi nhóm trình bày, một mẹo hữu ích là:,Đọc hết văn bản,Chỉ ra chủ đề trung tâm và các nhánh chính trước,Không giải thích gì,Ẩn sơ đồ,B,Vận dụng,Chủ đề E – Bài 6
K6E7_01,k6_e7_mindmap_software,Phần mềm sơ đồ tư duy ví dụ trong bài là:,Xmind,Paint,Wordpad,Calculator,A,Nhận biết,Chủ đề E – Bài 7
K6E7_02,k6_e7_mindmap_software,Điểm chung của các phần mềm sơ đồ tư duy là:,Chỉ vẽ tay,Đều có công cụ tạo chủ đề/nút và nhánh,Chỉ in ấn,Chỉ gõ văn bản,B,Nhận biết,Chủ đề E – Bài 7
K6E7_03,k6_e7_mindmap_software,Cách ra lệnh tạo chủ đề con thường là:,Insert Picture,Thêm Topic/Subtopic trên thanh công cụ,Print Preview,Track Changes,B,Nhận biết,Chủ đề E – Bài 7
K6E7_04,k6_e7_mindmap_software,File sơ đồ tư duy có thể:,Không lưu,Lưu và in/chiếu trên máy chiếu,Chỉ chụp ảnh,Chỉ gửi qua SMS,B,Nhận biết,Chủ đề E – Bài 7
K6E7_05,k6_e7_mindmap_software,Khả năng tự học phần mềm nghĩa là:,Phải học thuộc lòng,Đặt câu hỏi “làm thế nào để…?” và thử nghiệm chức năng,Không cần thao tác,Chỉ xem video,B,Nhận biết,Chủ đề E – Bài 7
K6E7_06,k6_e7_mindmap_software,Nếu muốn dùng trực tuyến thay vì cài đặt, ta có thể:,Không làm được,Chọn dịch vụ/ứng dụng online phù hợp,Dùng máy tính bảng làm quạt,Đổi hệ điều hành,B,Nhận biết,Chủ đề E – Bài 7
K6E7_07,k6_e7_mindmap_software,Lợi ích của làm quen giao diện File/Insert trong phần mềm là:,Không tác dụng,Tạo/lưu, chèn yếu tố hỗ trợ sơ đồ thuận lợi,Chỉ đổi màu,Chỉ in ấn,B,Thông hiểu,Chủ đề E – Bài 7
K6E7_08,k6_e7_mindmap_software,Vì sao nên để học sinh tự khám phá có định hướng?,Giảm hứng thú,Tăng tính chủ động, hình thành kĩ năng tự học,Không cần GV,Chỉ để điểm cao,B,Thông hiểu,Chủ đề E – Bài 7
K6E7_09,k6_e7_mindmap_software,Thực hành tóm tắt “Các thành phần mạng” bằng sơ đồ tư duy giúp:,Chỉ vẽ đẹp,Tổng hợp – hệ thống hoá kiến thức,Chỉ nhớ tên phần mềm,Không cần trình bày,B,Thông hiểu,Chủ đề E – Bài 7
K6E7_10,k6_e7_mindmap_software,Ưu điểm của phần mềm so với vẽ tay là:,Chậm hơn,Dễ sửa, nhân bản, in – chiếu, nhanh hơn,Khó lưu,Chỉ đen trắng,B,Thông hiểu,Chủ đề E – Bài 7
K6E7_11,k6_e7_mindmap_software,Tình huống: cần thêm nhanh một nhánh chi tiết. Bạn chọn:,Xoá sơ đồ,Vẽ lại từ đầu,Dùng lệnh thêm Subtopic/Branch,In ngay,C,Vận dụng,Chủ đề E – Bài 7
K6E7_12,k6_e7_mindmap_software,Bạn muốn đặt tên file “Thu.xmind” theo yêu cầu. Thao tác:,Save As và nhập tên tệp đúng,Print Preview,Replace All,Insert Shape,A,Vận dụng,Chủ đề E – Bài 7
K6E8_01,k6_e8_project,Làm dự án học tập giúp học sinh:,Chỉ học thuộc lòng,Rèn tự chủ, giao tiếp, hợp tác và trình bày,Chỉ giải trí,Chỉ nộp file,B,Nhận biết,Chủ đề E – Bài 8
K6E8_02,k6_e8_project,Đề tài dự án phù hợp với chủ đề sơ đồ tư duy là:,Tạo trò chơi 3D,Tổng kết một vấn đề bằng sơ đồ tư duy,Tăng tốc CPU,Thử nghiệm mạng xã hội,B,Nhận biết,Chủ đề E – Bài 8
K6E8_03,k6_e8_project,Bước đầu của dự án là:,Báo cáo điểm,Chuẩn bị – hiểu yêu cầu – phân nhóm,In ngay,Chấm điểm,A,Nhận biết,Chủ đề E – Bài 8
K6E8_04,k6_e8_project,Tiêu chí đánh giá sản phẩm dự án KHÔNG bao gồm:,Tính đúng – đủ yêu cầu,Tính trực quan, mạch lạc,Tinh thần hợp tác,Màu tóc của nhóm,D,Nhận biết,Chủ đề E – Bài 8
K6E8_05,k6_e8_project,Trong quá trình làm dự án, vai trò của GV là:,Làm hộ,Giám sát – tư vấn – hỗ trợ khi cần,Chấm ngay,In hộ,B,Nhận biết,Chủ đề E – Bài 8
K6E8_06,k6_e8_project,Một hình thức báo cáo dự án là:,Viết thư riêng,Thuyết trình nhóm trước lớp,Chỉ gửi email trống,Không báo cáo,B,Nhận biết,Chủ đề E – Bài 8
K6E8_07,k6_e8_project,Vì sao nên phân công cụ thể trong nhóm làm dự án?,Để ít người làm,Để phát huy sở trường và tiến độ rõ ràng,Để khỏi lưu,Bỏ qua hạn chót,B,Thông hiểu,Chủ đề E – Bài 8
K6E8_08,k6_e8_project,Liên hệ với chủ đề E: sản phẩm dự án có thể gồm:,Sơ đồ tư duy và báo cáo tóm tắt,Phần cứng tự chế,Ứng dụng mạng xã hội mới,Game bắn súng,A,Thông hiểu,Chủ đề E – Bài 8
K6E8_09,k6_e8_project,Khi thời gian gấp, chiến lược hợp lí là:,Không họp nhóm,Chia nhỏ nhiệm vụ – mốc kiểm tra – tổng hợp,Chờ phút chót,Không cần kế hoạch,B,Thông hiểu,Chủ đề E – Bài 8
K6E8_10,k6_e8_project,Điểm lợi của “chấm chéo” giữa các nhóm là:,Tăng tranh cãi,Giúp nhìn nhận đa chiều – học tập lẫn nhau,Giảm chất lượng,Không cần tiêu chí,B,Thông hiểu,Chủ đề E – Bài 8
K6E8_11,k6_e8_project,Nhóm cần trình bày lợi ích của sơ đồ tư duy. Cách làm thuyết phục:,Đọc văn bản dài,Trình chiếu sơ đồ, nêu chủ đề – nhánh chính – ví dụ ứng dụng,Không minh hoạ,Đổi chủ đề,B,Vận dụng,Chủ đề E – Bài 8
K6E8_12,k6_e8_project,Để nộp sản phẩm đúng quy định, nhóm nên:,Gửi tệp tên tuỳ ý,Không ghi nguồn,Lưu đúng định dạng/tên – nộp đúng hạn – chuẩn bị thuyết trình,Chỉ gửi ảnh màn hình,C,Vận dụng,Chủ đề E – Bài 8
