q_id,topic_id,question_text,option_A,option_B,option_C,option_D,correct_option,difficulty,source
K6C1_01,k6_c1_thong_tin_tren_web,Website là gì?,Một tệp văn bản,Ứng dụng di động,Tập hợp các trang web (web pages) có liên quan và cùng chung một địa chỉ,Ổ đĩa máy tính,C,Nhận biết,Chủ đề C – Bài 1
K6C1_02,k6_c1_thong_tin_tren_web,Địa chỉ website thường có đặc điểm nào?,Chỉ là số điện thoại,Chứa phần cố định của website và phần đuôi thay đổi theo từng trang,Chỉ là đường dẫn ảnh,Chỉ có ký tự số,B,Nhận biết,Chủ đề C – Bài 1
K6C1_03,k6_c1_thong_tin_tren_web,Trang web có thể dài hơn một màn hình hiển thị. Muốn xem phần dưới ta làm gì?,Phóng to ảnh,Cuộn (scroll) trang,Đổi trình duyệt,Đổi máy,B,Nhận biết,Chủ đề C – Bài 1
K6C1_04,k6_c1_thong_tin_tren_web,Siêu liên kết (hyperlink) giúp ta làm gì?,Chỉnh màu nền,Di chuyển đến vị trí/ trang khác liên quan,Phát nhạc,Tắt máy,B,Nhận biết,Chủ đề C – Bài 1
K6C1_05,k6_c1_thong_tin_tren_web,Dấu hiệu thường thấy khi trỏ chuột vào siêu liên kết là gì?,Chuột rung,Biểu tượng bàn tay xuất hiện,Âm thanh phát ra,Màn hình tắt,B,Nhận biết,Chủ đề C – Bài 1
K6C1_06,k6_c1_thong_tin_tren_web,Siêu văn bản là gì?,Đoạn văn bản/ hình ảnh chứa siêu liên kết,Ảnh nền,Video quảng cáo,Chỉ là văn bản thuần,A,Nhận biết,Chủ đề C – Bài 1
K6C1_07,k6_c1_thong_tin_tren_web,Phát biểu đúng về mục đích xây dựng website:,Chỉ để giải trí,Tồn tại để cá nhân/ tổ chức đưa thông tin, phục vụ chủ đề/ lĩnh vực nhất định,Chỉ dành cho người lớn,Chỉ đăng hình ảnh,B,Thông hiểu,Chủ đề C – Bài 1
K6C1_08,k6_c1_thong_tin_tren_web,Vì sao trang chủ và các trang con có địa chỉ khác nhau nhưng vẫn cùng một website?,Do phần cố định địa chỉ giữ nguyên, phần sau thay đổi theo trang,Do khác nhà cung cấp,Do khác phông chữ,Do khác màu nền,A,Thông hiểu,Chủ đề C – Bài 1
K6C1_09,k6_c1_thong_tin_tren_web,Khi duyệt trang tin, học sinh nên chú ý điều nào sau đây?,Chỉ nhìn tiêu đề,Quan sát bố cục, mục, liên kết để định vị thông tin,Không đọc nội dung,Chỉ xem ảnh,B,Thông hiểu,Chủ đề C – Bài 1
K6C1_10,k6_c1_thong_tin_tren_web,Nhận định nào đúng về nội dung trên website?,Không bao giờ đổi,Nội dung có thể thay đổi theo thời gian do cập nhật,Luôn sai,Luôn có phí,B,Thông hiểu,Chủ đề C – Bài 1
K6C1_11,k6_c1_thong_tin_tren_web,Bạn cần mở mục “Học trò 360” trên một báo điện tử. Thao tác phù hợp là:,In trang,Cuộn tìm mục rồi nhấp vào siêu liên kết mục đó,Tắt trình duyệt,Đổi ngôn ngữ,B,Vận dụng,Chủ đề C – Bài 1
K6C1_12,k6_c1_thong_tin_tren_web,Để ghi lại thông tin quan trọng trên web cho bài học, cách hợp lí là:,Chỉ nhớ trong đầu,Chụp màn hình/ ghi chú đường dẫn để xem lại,Đóng máy ngay,Lưu tùy ý vào thư rác,B,Vận dụng,Chủ đề C – Bài 1
K6C2_01,k6_c2_www_trinh_duyet,WWW (World Wide Web) là gì?,Một phần mềm,Chuỗi ký tự, Hệ thống các website liên kết với nhau trên Internet,Bộ nhớ máy,C,Nhận biết,Chủ đề C – Bài 2
K6C2_02,k6_c2_www_trinh_duyet,Trình duyệt web là:,Phần mềm ứng dụng để truy cập và xem nội dung website,Thiết bị phần cứng,Bảng tính,Trò chơi,A,Nhận biết,Chủ đề C – Bài 2
K6C2_03,k6_c2_www_trinh_duyet,Thanh nào để nhập địa chỉ trang web?,Thanh công cụ,Thanh cuộn,Ô địa chỉ (address bar),Thanh trạng thái,C,Nhận biết,Chủ đề C – Bài 2
K6C2_04,k6_c2_www_trinh_duyet,Trình duyệt phổ biến gồm:,Chrome, Firefox, Cốc Cốc, Safari,Word, Excel,Paint,Notepad,A,Nhận biết,Chủ đề C – Bài 2
K6C2_05,k6_c2_www_trinh_duyet,Khi truy cập https, ý nghĩa quan trọng là:,Trang sẽ tối màu,Mã hóa kênh truyền giúp an toàn hơn,Không tải được ảnh,Tự động đăng nhập,B,Nhận biết,Chủ đề C – Bài 2
K6C2_06,k6_c2_www_trinh_duyet,Dịch vụ nào dưới đây thường khai thác trên web?,Tra từ điển, xem thời tiết, tin thời sự,Chơi cờ thật,In ấn phần cứng,Lắp mạng,A,Nhận biết,Chủ đề C – Bài 2
K6C2_07,k6_c2_www_trinh_duyet,Sự khác nhau giữa www và trình duyệt là:,Giống nhau,www là hệ thống website; trình duyệt là phần mềm để truy cập web,www là phần mềm; trình duyệt là website,www chỉ là địa chỉ nhà,B,Thông hiểu,Chủ đề C – Bài 2
K6C2_08,k6_c2_www_trinh_duyet,Chuỗi thao tác đúng để mở một trang web là:,Mở Word → gõ URL,Mở trình duyệt → nhập địa chỉ → Enter,Mở Paint → nhập địa chỉ,Mở File Explorer → nhập địa chỉ,B,Thông hiểu,Chủ đề C – Bài 2
K6C2_09,k6_c2_www_trinh_duyet,Vì sao WWW giúp tìm kiếm/ chia sẻ kiến thức thuận lợi?,Vì chứa trò chơi,Do liên kết giữa các trang/ website cho phép điều hướng dễ dàng,Do có nhiều phím tắt,Do bắt buộc phải đăng ký,B,Thông hiểu,Chủ đề C – Bài 2
K6C2_10,k6_c2_www_trinh_duyet,Để xem tin thời tiết từ nguồn tin cậy, thao tác hợp lí là:,Gõ từ khóa mơ hồ,Truy cập website chính thống/ dùng trình duyệt nhập URL chuẩn,Tải tệp lạ bất kỳ,Nhấp quảng cáo,C,Thông hiểu,Chủ đề C – Bài 2
K6C2_11,k6_c2_www_trinh_duyet,Bạn muốn tra nghĩa từ tiếng Anh trên web:,Mở trình duyệt → vào trang từ điển uy tín → nhập từ khóa → xem kết quả,Nhập vào ứng dụng Paint,Chụp màn hình,Chỉ hỏi bạn bè,A,Vận dụng,Chủ đề C – Bài 2
K6C2_12,k6_c2_www_trinh_duyet,Bạn mở một website lạ, trình duyệt cảnh báo “không an toàn”. Nên:,Tiếp tục nhập mật khẩu,Đóng trang/ kiểm tra đường dẫn https/ chọn nguồn tin cậy,Chia sẻ link,Nhập email vào mọi ô,B,Vận dụng,Chủ đề C – Bài 2
K6C3_01,k6_c3_may_tim_kiem,Máy tìm kiếm (search engine) là gì?,Một trang web đặc biệt cho phép tìm thông tin trên WWW,Trình chỉnh ảnh,Máy in,Mạng LAN,A,Nhận biết,Chủ đề C – Bài 3
K6C3_02,k6_c3_may_tim_kiem,Ví dụ về máy tìm kiếm:,Google, Cốc Cốc, Yahoo,Bluetooth, HDMI, VGA,Excel, PowerPoint,Word, Paint,A,Nhận biết,Chủ đề C – Bài 3
K6C3_03,k6_c3_may_tim_kiem,Từ khóa (keyword) là gì?,Tên người dùng,Chuỗi mô tả nội dung cần tìm,Tên tệp ảnh,Mật khẩu,B,Nhận biết,Chủ đề C – Bài 3
K6C3_04,k6_c3_may_tim_kiem,Nơi nhập từ khóa trên trang máy tìm kiếm là:,Thanh địa chỉ trình duyệt,Ô tìm kiếm của máy tìm kiếm,Trên màn hình nền,Trong ứng dụng vẽ,B,Nhận biết,Chủ đề C – Bài 3
K6C3_05,k6_c3_may_tim_kiem,Cú pháp nào giúp tìm **chính xác cụm từ**?,Dùng dấu ngoặc kép “...”,Dấu phẩy,Dấu hỏi,Dấu chấm than,A,Nhận biết,Chủ đề C – Bài 3
K6C3_06,k6_c3_may_tim_kiem,Bước KHÔNG thuộc quy trình tìm kiếm cơ bản:,Mở trình duyệt,Nhập địa chỉ máy tìm kiếm,Nhập từ khóa,Định dạng ổ đĩa,D,Nhận biết,Chủ đề C – Bài 3
K6C3_07,k6_c3_may_tim_kiem,Vì sao cần chọn từ khóa phù hợp?,Để đẹp mắt,Để kết quả sát mục tiêu, tiết kiệm thời gian,Để có nhiều ảnh hơn,Để làm máy nhanh hơn,B,Thông hiểu,Chủ đề C – Bài 3
K6C3_08,k6_c3_may_tim_kiem,Khi quá nhiều kết quả, nên làm gì?,Dùng từ khóa cụ thể/ thêm cụm trong ngoặc kép/ bổ sung điều kiện,Chọn bừa trang đầu,Nhập từ khóa ngẫu nhiên,Chỉ xem hình ảnh,A,Thông hiểu,Chủ đề C – Bài 3
K6C3_09,k6_c3_may_tim_kiem,Nhập từ khóa bằng giọng nói có ưu điểm gì?,Không cần mạng,Nhanh và tiện trên thiết bị di động,Tự động viết báo cáo,Tự động tải video,B,Thông hiểu,Chủ đề C – Bài 3
K6C3_10,k6_c3_may_tim_kiem,Thông tin **riêng tư/ít người quan tâm** thường:,Rất dễ tìm,Khó/ không tìm thấy trên máy tìm kiếm,Luôn ở trang đầu,Luôn có video,B,Thông hiểu,Chủ đề C – Bài 3
K6C3_11,k6_c3_may_tim_kiem,Tìm tài liệu “biến đổi khí hậu Việt Nam” sát nhất:,biến đổi khí hậu,biến đổi khí hậu ở Việt Nam “báo cáo”,thời tiết,khí hậu,AWS,B,Vận dụng,Chủ đề C – Bài 3
K6C3_12,k6_c3_may_tim_kiem,Cần tệp PDF từ trang chính thức Bộ GDĐT, truy vấn phù hợp là:,site:moet.gov.vn filetype:pdf hướng dẫn,hướng dẫn jpg,filetype:mp3 hướng dẫn,moet game,A,Vận dụng,Chủ đề C – Bài 3
K6C4_01,k6_c4_thuc_hanh_tim_kiem,Bước đầu tiên khi tìm thông tin hỗ trợ học Địa lí là:,Mở trình duyệt và chọn máy tìm kiếm (vd: google.com),Mở máy in,Mở máy ảnh,Mở Paint,A,Nhận biết,Chủ đề C – Bài 4
K6C4_02,k6_c4_thuc_hanh_tim_kiem,Từ khóa để tìm nội dung về khí hậu VN có thể là:,“truyện cười”,“biến đổi khí hậu ở Việt Nam”,“tuyển sinh lớp 10”,“chơi game”,B,Nhận biết,Chủ đề C – Bài 4
K6C4_03,k6_c4_thuc_hanh_tim_kiem,Sau khi có kết quả tìm kiếm ta cần:,Chọn kết quả phù hợp và đọc/ tóm tắt,Đóng máy,Đổi hình nền,In ngay,A,Nhận biết,Chủ đề C – Bài 4
K6C4_04,k6_c4_thuc_hanh_tim_kiem,Lưu tên tệp báo cáo phù hợp là:,New Document,Ảnh 1,Bài tập Địa lí,Không cần lưu,C,C,Nhận biết,Chủ đề C – Bài 4
K6C4_05,k6_c4_thuc_hanh_tim_kiem,Nguồn tin cậy thường là:,Trang chính thống/ cơ quan/ giáo dục,Trang lạ không rõ nguồn,Quảng cáo ngẫu nhiên,Diễn đàn ẩn danh,A,Nhận biết,Chủ đề C – Bài 4
K6C4_06,k6_c4_thuc_hanh_tim_kiem,Để tìm điểm du lịch ở Hạ Long, thao tác phù hợp:,Gõ “địa điểm tham quan Hạ Long”,Gõ “bài hát thiếu nhi”,Gõ “phần mềm vẽ”,Gõ “máy in”,A,Nhận biết,Chủ đề C – Bài 4
K6C4_07,k6_c4_thuc_hanh_tim_kiem,Vì sao cần tóm tắt sau khi đọc một trang web?,Để nhớ lâu, trích xuất ý chính phục vụ học tập,Vì đẹp,Để tăng bộ nhớ,Để đổi phông,B,Thông hiểu,Chủ đề C – Bài 4
K6C4_08,k6_c4_thuc_hanh_tim_kiem,Khi kết quả chưa phù hợp, nên:,Điều chỉnh/ bổ sung từ khóa,Không tìm nữa,Tắt mạng,Chụp màn hình,B,Thông hiểu,Chủ đề C – Bài 4
K6C4_09,k6_c4_thuc_hanh_tim_kiem,Từ khóa có dấu ngoặc kép giúp:,Trang đẹp hơn,Giới hạn kết quả đúng cụm từ,Phóng to ảnh,Tự động lưu,C,Thông hiểu,Chủ đề C – Bài 4
K6C4_10,k6_c4_thuc_hanh_tim_kiem,Bạn muốn tìm **tác giả bài hát yêu thích**, nên kèm từ khóa nào?,“ảnh đẹp”,“tác giả”,“địa chỉ nhà”,“thời khóa biểu”,B,Thông hiểu,Chủ đề C – Bài 4
K6C4_11,k6_c4_thuc_hanh_tim_kiem,Hoàn thành bài tập địa lí yêu cầu tóm tắt ngắn gọn. Cách làm hợp lí:,Sao chép toàn bộ,Chỉ chụp ảnh,Đọc – rút ý chính – ghi nguồn,Đổi tên nguồn,C,Vận dụng,Chủ đề C – Bài 4
K6C4_12,k6_c4_thuc_hanh_tim_kiem,Nhóm bạn tìm **3 điểm tham quan Hạ Long**. Đáp án nào **đúng** theo ví dụ mẫu?,Bãi biển Mỹ Khê – Phú Quốc – Bản Giốc,Vịnh Bái Tử Long – Khu di tích Yên Tử – Bán đảo Tuần Châu,Hồ Gươm – Fansipan – Đà Lạt,Tháp Chàm – Mũi Né – Củ Chi,B,Vận dụng,Chủ đề C – Bài 4
K6C5_01,k6_c5_thu_dien_tu,Thư điện tử (email) là:,Phương tiện gửi/nhận thông điệp qua mạng,Thiết bị in,Ổ cứng,Ứng dụng vẽ,A,Nhận biết,Chủ đề C – Bài 5
K6C5_02,k6_c5_thu_dien_tu,Địa chỉ email có dạng chung:,ten@ten_dich_vu,ten#ten_dich_vu,ten-ten_dich_vu,ten/ten_dich_vu,A,Nhận biết,Chủ đề C – Bài 5
K6C5_03,k6_c5_thu_dien_tu,Cấu trúc mẫu thư điện tử **bắt buộc** có:,Người nhận (To),Chủ đề, Tệp đính kèm,Sticker,A,Nhận biết,Chủ đề C – Bài 5
K6C5_04,k6_c5_thu_dien_tu,Ưu điểm nổi bật của email so với thư giấy:,Rất nhanh, có thể gửi nhiều người, đính kèm đa dạng,Chỉ gửi 1 người,Không gửi kèm được,Luôn mất phí,A,Nhận biết,Chủ đề C – Bài 5
K6C5_05,k6_c5_thu_dien_tu,Nhược điểm/ mặt trái có thể gặp của email:,Không bao giờ có virus,Gặp thư giả mạo/ lừa đảo/ thư rác,Đọc thư mất tiền,Không gửi được ảnh,B,Nhận biết,Chủ đề C – Bài 5
K6C5_06,k6_c5_thu_dien_tu,Chức năng **Trả lời (Reply)** dùng để:,Gửi lại cho người gửi ban đầu,In ngay,Xóa thư,Đổi mật khẩu,A,Nhận biết,Chủ đề C – Bài 5
K6C5_07,k6_c5_thu_dien_tu,Vì sao email được coi là thân thiện môi trường hơn thư giấy?,Do màu đẹp,Do không dùng giấy in,Do tắt máy nhanh,Do có hình động,B,Thông hiểu,Chủ đề C – Bài 5
K6C5_08,k6_c5_thu_dien_tu,Vì sao cần cảnh giác với tệp đính kèm lạ?,Vì nặng máy, Vì có thể chứa mã độc/ lừa đảo, làm lộ thông tin, Vì đẹp, Vì phát nhạc,B,Thông hiểu,Chủ đề C – Bài 5
K6C5_09,k6_c5_thu_dien_tu,Để gửi một thư cho **nhiều người**, thao tác hợp lí là:,Gửi từng thư thủ công,Sử dụng trường To/CC phù hợp,Đăng lên mạng xã hội,Gửi qua SMS,B,Thông hiểu,Chủ đề C – Bài 5
K6C5_10,k6_c5_thu_dien_tu,Tên đăng nhập nên đặt thế nào?,Tùy ý có ký tự đặc biệt khó đọc,Phản ánh tên/ lớp/ năm sinh (phù hợp môi trường học đường),Chỉ số ngẫu nhiên,Viết toàn dấu cách,B,Thông hiểu,Chủ đề C – Bài 5
K6C5_11,k6_c5_thu_dien_tu,Bạn cần soạn thư gửi cô giáo kèm bưu thiếp **20/11**. Cách làm đúng:,Soạn thư rõ chủ đề + nội dung; đính kèm file đúng; gửi,Chỉ đính kèm không nội dung,Để trống To,Gửi file .exe,A,Vận dụng,Chủ đề C – Bài 5
K6C5_12,k6_c5_thu_dien_tu,Nhận thư lạ yêu cầu cung cấp mật khẩu/OTP. Bạn nên:,Trả lời ngay,Chuyển tiếp cho nhiều người,Cảnh giác – không cung cấp – báo spam/phishing,Đổi ảnh đại diện,C,Vận dụng,Chủ đề C – Bài 5
K6C6_01,k6_c6_thuc_hanh_email,Bước đầu khi **tạo tài khoản email** là:,Truy cập gmail.com và chọn Tạo tài khoản,Mở Paint,Nhập mật khẩu vào ô tìm kiếm,In tài liệu,A,Nhận biết,Chủ đề C – Bài 6
K6C6_02,k6_c6_thuc_hanh_email,Bước đăng nhập đúng là:,Nhập địa chỉ và mật khẩu → Đăng nhập,Nhập tên bài hát,Chọn ảnh nền,Chọn máy in,A,Nhận biết,Chủ đề C – Bài 6
K6C6_03,k6_c6_thuc_hanh_email,Để **soạn thư mới** ta chọn nút nào trong Gmail?,Soạn (Compose),Tạo thư mục,In,Xóa,A,Nhận biết,Chủ đề C – Bài 6
K6C6_04,k6_c6_thuc_hanh_email,Đọc thư mới nhận ở đâu?,Hộp thư đến (Inbox),Thùng rác,Spam,Ưu tiên,A,Nhận biết,Chủ đề C – Bài 6
K6C6_05,k6_c6_thuc_hanh_email,Chức năng **Chuyển tiếp (Forward)** dùng để:,Gửi lại thư đó cho địa chỉ khác,In thư,Xóa tài khoản,Đổi ngôn ngữ,A,Nhận biết,Chủ đề C – Bài 6
K6C6_06,k6_c6_thuc_hanh_email,Tại sao cần **đăng xuất** khi dùng máy công cộng?,Để tiết kiệm pin,Để tránh người khác truy cập trái phép tài khoản email,Để tăng tốc mạng,Để xóa thư,B,Nhận biết,Chủ đề C – Bài 6
K6C6_07,k6_c6_thuc_hanh_email,Thực hành: soạn thư gửi bạn cùng lớp **góp ý thân thiện**. Điểm cần lưu ý là:,Gửi rỗng nội dung,Viết lịch sự, nêu rõ chủ đề, kiểm tra địa chỉ người nhận, gửi,Đính kèm file .exe,Không ghi tên người nhận,B,Thông hiểu,Chủ đề C – Bài 6
K6C6_08,k6_c6_thuc_hanh_email,Để đính kèm tệp vào thư, thao tác đúng:,Chọn biểu tượng ghim/ Attach → chọn tệp,Nhập tên tệp ở ô Chủ đề,Dán tệp vào nội dung,Đổi giao diện,A,Thông hiểu,Chủ đề C – Bài 6
K6C6_09,k6_c6_thuc_hanh_email,Khi quên đăng xuất trên máy lạ, nên làm gì ở nhà?,Bỏ qua,Đăng xuất từ xa/ đổi mật khẩu,Chia sẻ mật khẩu,In thư,B,Thông hiểu,Chủ đề C – Bài 6
K6C6_10,k6_c6_thuc_hanh_email,Thao tác nào giúp quản lí thư đến tốt hơn?,Tạo nhãn/ thư mục và lọc thư,Chỉ để tất cả ở Inbox,Xóa toàn bộ,Chuyển hết vào Spam,A,Thông hiểu,Chủ đề C – Bài 6
K6C6_11,k6_c6_thuc_hanh_email,Bài tập yêu cầu gửi thư kèm **bưu thiếp 20/11** cho GV. Trình tự hợp lí:,Đăng nhập → Soạn → Nhập người nhận → Chủ đề → Nội dung → Đính kèm → Gửi,Soạn trước rồi đăng nhập,Đính kèm trước khi mở Gmail,Chỉ nhập người nhận,A,Vận dụng,Chủ đề C – Bài 6
K6C6_12,k6_c6_thuc_hanh_email,Bạn nhận nhiều thư rác quảng cáo. Cách xử lí phù hợp là:,Trả lời tất cả,Đánh dấu Spam/ chặn người gửi,Chia sẻ cho lớp,Xóa tài khoản,B,Vận dụng,Chủ đề C – Bài 6
