q_id,topic_id,question_text,option_A,option_B,option_C,option_D,correct_option,difficulty,source
K6D1_01,k6_d1_mat_trai_internet,Virus máy tính là gì?,Phần cứng tăng tốc máy,Phần mềm có khả năng tự nhân bản và lây lan qua thiết bị/mạng,Tập tin ảnh,Ứng dụng học tập,B,Nhận biết,Chủ đề D – Bài 1
K6D1_02,k6_d1_mat_trai_internet,Hành vi nào dễ khiến máy nhiễm mã độc?,Chỉ mở tệp từ thầy cô,Cập nhật phần mềm,Nháy vào liên kết lạ trong email từ người không quen,Dùng mật khẩu mạnh,C,Nhận biết,Chủ đề D – Bài 1
K6D1_03,k6_d1_mat_trai_internet,Thiết bị trung gian có thể làm lây virus là gì?,Chuột,Bàn phím,USB/ổ di động,Màn hình,C,Nhận biết,Chủ đề D – Bài 1
K6D1_04,k6_d1_mat_trai_internet,Tác hại nào sau đây liên quan lạm dụng Internet?,Tăng khả năng đọc sách,Lười suy nghĩ, giảm sáng tạo do ỷ lại tìm kiếm,Luôn đúng giờ,Tăng sức khỏe,B,Nhận biết,Chủ đề D – Bài 1
K6D1_05,k6_d1_mat_trai_internet,Nội dung xấu/độc hại trên mạng có thể gây gì?,Cải thiện điểm số,Không ảnh hưởng,Lệch chuẩn hành vi, vi phạm thuần phong mỹ tục,Tăng tốc máy,C,Nhận biết,Chủ đề D – Bài 1
K6D1_06,k6_d1_mat_trai_internet,Dấu hiệu dễ nhận biết thư rác/lừa đảo là gì?,Tiêu đề chung chung, hứa hẹn hấp dẫn, gửi từ địa chỉ lạ,Chỉ gửi từ trường học,Luôn có tệp .pdf từ cô giáo,Không có lỗi chính tả,A,Nhận biết,Chủ đề D – Bài 1
K6D1_07,k6_d1_mat_trai_internet,Vì sao không nên mở email/tệp đính kèm không rõ nguồn?,Tốn pin,Mất lịch sử trình duyệt,Có thể chứa mã độc dẫn tới mất dữ liệu/tài khoản,Giảm âm lượng,C,Thông hiểu,Chủ đề D – Bài 1
K6D1_08,k6_d1_mat_trai_internet,Khác biệt giữa “thông tin” và “tin đồn trên mạng xã hội” là gì?,Tin đồn luôn đúng,Thông tin có nguồn kiểm chứng; tin đồn thường thiếu căn cứ,Thông tin luôn sai,Không khác nhau,B,Thông hiểu,Chủ đề D – Bài 1
K6D1_09,k6_d1_mat_trai_internet,Dấu hiệu của nghiện Internet/mạng xã hội là:,Tập thể thao nhiều hơn,Giảm ngủ, xao nhãng học tập, tránh giao tiếp trực tiếp,Luôn đọc sách giấy,Tăng điểm số,B,Thông hiểu,Chủ đề D – Bài 1
K6D1_10,k6_d1_mat_trai_internet,Biện pháp chung để **phòng ngừa** tác hại Internet là:,Tắt máy vĩnh viễn,Sử dụng phần mềm diệt virus, thói quen an toàn, giới hạn thời gian,Chia sẻ mọi mật khẩu,Tải mọi ứng dụng,C,Thông hiểu,Chủ đề D – Bài 1
K6D1_11,k6_d1_mat_trai_internet,Tình huống: Bạn nhận liên kết “trúng thưởng” yêu cầu đăng nhập. Ứng xử đúng là:,Đăng nhập ngay để nhận quà,Chia sẻ cho bạn bè,Cảnh giác, không nhấp; báo người lớn/nhà trường; xoá thư,Cài lại Windows,C,Vận dụng,Chủ đề D – Bài 1
K6D1_12,k6_d1_mat_trai_internet,Khi phải dùng USB của người khác, thao tác phù hợp là:,Cắm ngay và mở mọi tệp,Chỉ mở trên điện thoại,Quét virus trước/ sau khi dùng; không chạy tệp lạ,Định dạng máy tính,C,Vận dụng,Chủ đề D – Bài 1
K6D2_01,k6_d2_an_toan_hop_phap,Thông tin cá nhân là gì?,Chỉ là điểm số,Những dữ liệu định danh như họ tên, địa chỉ, số điện thoại, tài khoản…,Ảnh phong cảnh,Mật khẩu của người khác,B,Nhận biết,Chủ đề D – Bài 2
K6D2_02,k6_d2_an_toan_hop_phap,Thông tin tập thể (tổ chức/lớp) gồm ví dụ nào?,Món ăn yêu thích,Tên tổ chức, địa chỉ liên hệ, tài khoản chính thức,Đội bóng ưa thích,Kho game,B,Nhận biết,Chủ đề D – Bài 2
K6D2_03,k6_d2_an_toan_hop_phap,Hành vi nào **không hợp pháp/không an toàn**?,Được phép rồi mới đăng,Đăng thông tin cá nhân của người khác khi họ **chưa đồng ý**,Trích nguồn rõ ràng,Đặt quyền riêng tư phù hợp,B,Nhận biết,Chủ đề D – Bài 2
K6D2_04,k6_d2_an_toan_hop_phap,Chia sẻ thông tin an toàn cần:,Chọn lọc nguồn tin cậy, tránh tin giả; tôn trọng bản quyền; xin phép trước khi công bố,Đăng càng nhanh càng tốt,Không cần kiểm chứng,Che nguồn,A,Nhận biết,Chủ đề D – Bài 2
K6D2_05,k6_d2_an_toan_hop_phap,Mục đích của **mật khẩu mạnh** là:,Trang trí,Tăng âm lượng,Giảm nguy cơ bị chiếm đoạt tài khoản,Đổi hình nền,C,Nhận biết,Chủ đề D – Bài 2
K6D2_06,k6_d2_an_toan_hop_phap,Biện pháp bảo vệ tài khoản **không đúng** là:,Bật 2FA,Không tiết lộ OTP,Chia sẻ mật khẩu với bạn thân,Đặt mật khẩu dài, có chữ/số/kí tự đặc biệt,C,Nhận biết,Chủ đề D – Bài 2
K6D2_07,k6_d2_an_toan_hop_phap,Vì sao pháp luật bảo vệ thông tin cá nhân/tập thể?,Để tăng quảng cáo,Để đảm bảo quyền riêng tư, an toàn và tránh lạm dụng,Để tăng tốc Internet,Để xoá dữ liệu,B,Thông hiểu,Chủ đề D – Bài 2
K6D2_08,k6_d2_an_toan_hop_phap,Cách **chia sẻ tài liệu** của lớp hợp pháp là:,Đăng công khai mọi nơi,Dùng kênh chính thức của lớp, thiết lập quyền xem/sửa phù hợp, trích nguồn,Bỏ nguồn,Đổi tên tác giả,B,Thông hiểu,Chủ đề D – Bài 2
K6D2_09,k6_d2_an_toan_hop_phap,Trên mạng xã hội, đặt **quyền riêng tư** (privacy) giúp:,Tự động viết bài,Tăng tốc CPU,Kiểm soát ai được xem nội dung,Luôn công khai,C,Thông hiểu,Chủ đề D – Bài 2
K6D2_10,k6_d2_an_toan_hop_phap,Chia sẻ ảnh bạn cùng lớp **có biển số nhà/SDT** là:,Bình thường,An toàn,Tiềm ẩn rủi ro lộ thông tin cá nhân,Không liên quan,C,Thông hiểu,Chủ đề D – Bài 2
K6D2_11,k6_d2_an_toan_hop_phap,Tình huống: Cần kêu gọi quyên góp, nhưng bạn muốn **giữ an toàn** cho lớp. Cách làm đúng là:,Đăng toàn bộ danh sách người ủng hộ kèm số,Chỉ đăng thông tin cần thiết, xin phép trước khi nêu tên, ẩn thông tin nhạy cảm,Đăng ảnh CMND của mọi người,Đăng lúc nửa đêm,B,Vận dụng,Chủ đề D – Bài 2
K6D2_12,k6_d2_an_toan_hop_phap,Bạn nhận nhắn tin yêu cầu **mật khẩu/OTP** để “xác minh”. Ứng xử phù hợp:,Cung cấp ngay,Chia sẻ cho nhóm lớp,Báo lừa đảo, **không** cung cấp; xác minh qua kênh chính thức,Đổi điện thoại,C,Vận dụng,Chủ đề D – Bài 2
K6D3_01,k6_d3_thuc_hanh_phong_ve,Dấu hiệu chung của **email quảng cáo/ spam** là:,Từ cô giáo, tiêu đề bài tập,Tiêu đề chung chung, mồi chào hấp dẫn, địa chỉ lạ, lỗi chính tả,Không có liên kết,Chỉ là ảnh mèo,B,Nhận biết,Chủ đề D – Bài 3
K6D3_02,k6_d3_thuc_hanh_phong_ve,**Phishing** thường dùng chiêu gì?,Đòi mật khẩu/OTP, giả danh ngân hàng/cơ quan, trang trúng thưởng,Chỉ gửi ảnh mèo,Tăng điểm T.Dục,Tặng CPU,A,Nhận biết,Chủ đề D – Bài 3
K6D3_03,k6_d3_thuc_hanh_phong_ve,Thao tác cơ bản khi dùng **phần mềm diệt virus** là:,Gỡ mọi phần mềm,Ngắt mạng,Khởi chạy chương trình → cập nhật cơ sở dữ liệu → quét → xử lý phát hiện,Tắt máy,C,Nhận biết,Chủ đề D – Bài 3
K6D3_04,k6_d3_thuc_hanh_phong_ve,BKAV/antivirus có thể giúp gì?,Xoá bài tập hộ,Phát hiện/ngăn chặn nhiều loại mã độc, đảm bảo an toàn hơn,Thay giáo viên,Chặn Wi-Fi,B,Nhận biết,Chủ đề D – Bài 3
K6D3_05,k6_d3_thuc_hanh_phong_ve,Mật khẩu mạnh thường:,Ngắn, dễ đoán,Dài (≥10–12), gồm chữ HOA/thường, số, kí tự đặc biệt, khó đoán,Chỉ là ngày sinh,Chung cho nhiều tài khoản,B,Nhận biết,Chủ đề D – Bài 3
K6D3_06,k6_d3_thuc_hanh_phong_ve,Cần làm gì khi đăng nhập ở **máy công cộng**?,Lưu mật khẩu trên trình duyệt,Giữ đăng nhập mãi,Đăng xuất sau khi dùng; không lưu mật khẩu,Chia sẻ tài khoản,C,Nhận biết,Chủ đề D – Bài 3
K6D3_07,k6_d3_thuc_hanh_phong_ve,Vì sao **không có** phần mềm diệt virus “vạn năng”?,Vì không có Internet,Vì mọi mã độc giống nhau,Vì kỹ thuật tấn công thay đổi; ý thức người dùng vẫn là yếu tố quyết định,Do máy yếu,C,Thông hiểu,Chủ đề D – Bài 3
K6D3_08,k6_d3_thuc_hanh_phong_ve,Cách kiểm tra **độ mạnh mật khẩu** an toàn là:,Gõ mật khẩu vào mọi trang lạ,Sử dụng công cụ uy tín, không nhập mật khẩu thật; áp dụng nguyên tắc tạo mật khẩu mạnh,Viết lên bảng lớp,Chia sẻ nhóm chat,B,Thông hiểu,Chủ đề D – Bài 3
K6D3_09,k6_d3_thuc_hanh_phong_ve,Bước đầu **khoá tài khoản** khi nghi bị lộ là:,Đăng nhập thêm thiết bị,Đổi hình nền,Đổi mật khẩu, bật 2FA, đăng xuất khỏi các phiên lạ,Tắt chuông,C,Thông hiểu,Chủ đề D – Bài 3
K6D3_10,k6_d3_thuc_hanh_phong_ve,Thói quen email an toàn gồm:,Mở mọi tệp .exe,Mặc định tin mọi link,Kiểm tra địa chỉ người gửi; rà soát liên kết; chỉ tải tệp từ nguồn tin cậy,Chia sẻ OTP,C,Thông hiểu,Chủ đề D – Bài 3
K6D3_11,k6_d3_thuc_hanh_phong_ve,Tình huống: Nhận email “tri ân khách hàng” kèm link đăng nhập ngân hàng.,Nhấp ngay và nhập,Chuyển tiếp cho lớp,Truy cập **trang chính thức** bằng cách tự gõ URL/ứng dụng; báo lừa đảo nếu cần,Đổi ảnh đại diện,C,Vận dụng,Chủ đề D – Bài 3
K6D3_12,k6_d3_thuc_hanh_phong_ve,Nhiệm vụ: Quét USB lớp dùng chung. Quy trình đúng là:,Cắm và chạy tệp .exe bất kỳ,Cắm → quét với antivirus cập nhật → chỉ mở tệp cần thiết → tháo an toàn,Chép mọi thứ vào C:,Tắt antivirus,B,Vận dụng,Chủ đề D – Bài 3
