q_id,topic_id,question_text,option_A,option_B,option_C,option_D,correct_option,difficulty,source
K8E2_01,E2_Soan_thao_nang_cao,Để vẽ các hình khối (như hình chữ nhật, mũi tên, ngôi sao...) trong văn bản, ta sử dụng lệnh nào?,Insert > Chart,Insert > Shapes,Insert > SmartArt,Insert > Picture,B,Nhận biết,Tin 8 - Chủ đề E2 - Bài 1
K8E2_02,E2_Soan_thao_nang_cao,Để chèn một tệp hình ảnh từ máy tính vào văn bản, ta thực hiện thao tác nào?,Insert > Picture > This Device,Insert > Shapes,Home > Paste,Design > Watermark,A,Nhận biết,Tin 8 - Chủ đề E2 - Bài 1
K8E2_03,E2_Soan_thao_nang_cao,Tính năng "Text Wrapping" (gói văn bản) dùng để làm gì?,Thay đổi màu sắc của hình ảnh,Điều chỉnh cách văn bản bao quanh hoặc nằm đè lên hình ảnh/hình vẽ,Xoay hình ảnh 90 độ,Tạo khung viền cho hình ảnh,B,Nhận biết,Tin 8 - Chủ đề E2 - Bài 1
K8E2_04,E2_Soan_thao_nang_cao,Để chọn đồng thời nhiều đối tượng hình vẽ cùng lúc, ta cần nhấn giữ phím nào khi nhấp chuột?,Phím Enter,Phím Shift hoặc Ctrl,Phím Alt,Phím Space (Cách),B,Nhận biết,Tin 8 - Chủ đề E2 - Bài 1
K8E2_05,E2_Soan_thao_nang_cao,Lệnh "Group" (Nhóm) các đối tượng đồ họa có tác dụng gì?,Biến nhiều đối tượng rời rạc thành một khối thống nhất để dễ dàng di chuyển hoặc thay đổi kích thước chung,Xóa các đối tượng đó,Làm các đối tượng thẳng hàng,Tách các đối tượng ra riêng lẻ,A,Nhận biết,Tin 8 - Chủ đề E2 - Bài 1
K8E2_06,E2_Soan_thao_nang_cao,Khi chọn chế độ Text Wrapping là "In Line With Text" (Nằm trên dòng văn bản), hình ảnh sẽ cư xử như thế nào?,Hình ảnh trôi nổi tự do trên trang giấy,Hình ảnh được coi như một kí tự dạng văn bản và nằm cố định trên dòng,Văn bản sẽ bao quanh hình ảnh theo khung vuông,Hình ảnh nằm chìm dưới chữ,B,Thông hiểu,Tin 8 - Chủ đề E2 - Bài 1
K8E2_07,E2_Soan_thao_nang_cao,Tại sao khi thay đổi kích thước hình ảnh, ta nên kéo thả tại các "nút tròn ở 4 góc" thay vì ở cạnh?,Để xóa hình ảnh,Để giữ nguyên tỉ lệ khung hình (không bị méo hình),Để xoay hình ảnh,Để cắt bớt hình ảnh,B,Thông hiểu,Tin 8 - Chủ đề E2 - Bài 1
K8E2_08,E2_Soan_thao_nang_cao,Em đã chèn hai hình vẽ chồng lên nhau, nhưng hình cần hiển thị lại bị hình kia che mất. Em dùng lệnh nào để đưa hình bị che lên phía trước?,Send Backward (Đưa ra sau),Bring Forward (Đưa lên trước),Align Center,Rotate,B,Thông hiểu,Tin 8 - Chủ đề E2 - Bài 1
K8E2_09,E2_Soan_thao_nang_cao,Sự khác biệt giữa "Insert Shapes" và "Insert Picture" là gì?,Shapes là hình vẽ đồ họa vector (có thể thay đổi màu nền/viền) còn Picture thường là ảnh chụp/ảnh bitmap,Shapes không thể thay đổi kích thước còn Picture thì có,Picture có thể viết chữ vào trong còn Shapes thì không,Không có gì khác biệt,A,Thông hiểu,Tin 8 - Chủ đề E2 - Bài 1
K8E2_10,E2_Soan_thao_nang_cao,Em muốn thiết kế một "Sơ đồ lớp học" gồm các bàn ghế (hình chữ nhật) và tên học sinh bên trong. Sau khi vẽ xong một bàn, để tạo nhanh các bàn còn lại giống hệt, em nên làm gì?,Vẽ lại từng cái một cho đẹp,Sử dụng lệnh Copy và Paste (hoặc giữ Ctrl + kéo thả) để sao chép đối tượng,Chụp ảnh màn hình rồi dán vào,Nhờ bạn vẽ hộ,B,Vận dụng,Tin 8 - Chủ đề E2 - Bài 1
K8E2_11,E2_Soan_thao_nang_cao,Em đang trình bày văn bản có hình ảnh minh họa, em muốn văn bản bao quanh sát theo đường viền của hình ảnh (kể cả hình tròn hay hình ngôi sao) chứ không phải khung vuông. Em chọn kiểu Text Wrapping nào?,Square,Tight,Behind Text,In Front of Text,B,Vận dụng,Tin 8 - Chủ đề E2 - Bài 1
K8E2_12,E2_Soan_thao_nang_cao,Để vẽ một hình tròn hoàn hảo (thay vì hình bầu dục) hoặc hình vuông (thay vì hình chữ nhật) bằng công cụ Shapes, em cần nhấn giữ phím nào khi vẽ?,Phím Shift,Phím Ctrl,Phím Alt,Phím Tab,A,Vận dụng,Tin 8 - Chủ đề E2 - Bài 1
q_id,topic_id,question_text,option_A,option_B,option_C,option_D,correct_option,difficulty,source
K8E2_B3_01,E2_Soan_thao_nang_cao,Để tạo danh sách liệt kê dạng kí hiệu (dấu chấm tròn, vuông...), ta dùng lệnh nào trong nhóm Paragraph?,Numbering,Bullets,Multilevel List,Align Left,B,Nhận biết,Tin 8 - Chủ đề E2 - Bài 3
K8E2_B3_02,E2_Soan_thao_nang_cao,Lệnh "Numbering" (đánh số thứ tự) thường được dùng cho loại danh sách nào?,Danh sách các bước thực hiện theo quy trình tuần tự (1, 2, 3...),Danh sách các món ăn ngẫu nhiên,Danh sách các đồ vật không quan trọng thứ tự,Danh sách hình ảnh,A,Nhận biết,Tin 8 - Chủ đề E2 - Bài 3
K8E2_B3_03,E2_Soan_thao_nang_cao,Phần "Header" (Đầu trang) là phần văn bản nằm ở đâu?,Nằm ở lề trái trang giấy,Nằm ở lề dưới cùng của mỗi trang,Nằm ở lề trên cùng của mỗi trang,Nằm giữa trang giấy,C,Nhận biết,Tin 8 - Chủ đề E2 - Bài 3
K8E2_B3_04,E2_Soan_thao_nang_cao,Thông tin nào thường được đặt ở phần "Footer" (Chân trang)?,Tiêu đề chính của bài văn,Số trang (Page Number) và tên tác giả,Hình ảnh minh họa lớn,Nội dung chi tiết của văn bản,B,Nhận biết,Tin 8 - Chủ đề E2 - Bài 3
K8E2_B3_05,E2_Soan_thao_nang_cao,Để thêm số trang tự động vào văn bản, ta vào thẻ Insert và chọn lệnh nào?,Page Number,Shapes,WordArt,Table,A,Nhận biết,Tin 8 - Chủ đề E2 - Bài 3
K8E2_B3_06,E2_Soan_thao_nang_cao,Tại sao nên sử dụng danh sách liệt kê (Bullets/Numbering) thay vì gõ thủ công dấu gạch đầu dòng?,Để văn bản đẹp hơn và máy tính tự động căn chỉnh lề đều nhau khi xuống dòng,Để máy tính chạy nhanh hơn,Vì gõ thủ công không được phép,Vì gõ thủ công sẽ bị lỗi phông chữ,A,Thông hiểu,Tin 8 - Chủ đề E2 - Bài 3
K8E2_B3_07,E2_Soan_thao_nang_cao,Điều gì xảy ra với nội dung trong Header/Footer khi văn bản có nhiều trang?,Nội dung đó chỉ hiện ở trang 1,Nội dung đó sẽ tự động xuất hiện lặp lại ở tất cả các trang,Nội dung đó sẽ bị xóa khi sang trang mới,Nội dung đó sẽ chuyển xuống giữa trang,B,Thông hiểu,Tin 8 - Chủ đề E2 - Bài 3
K8E2_B3_08,E2_Soan_thao_nang_cao,Nếu em muốn trang đầu tiên KHÔNG hiện số trang (ví dụ trang bìa), em cần tích chọn mục nào trong thẻ Design của Header & Footer?,Different Odd & Even Pages,Different First Page,Show Document Text,Link to Previous,B,Thông hiểu,Tin 8 - Chủ đề E2 - Bài 3
K8E2_B3_09,E2_Soan_thao_nang_cao,Khi xóa một mục trong danh sách có đánh số tự động (ví dụ xóa mục số 2), điều gì xảy ra với các mục phía sau?,Các mục phía sau giữ nguyên số cũ (bị khuyết số 2),Các mục phía sau tự động cập nhật lại số thứ tự (mục 3 thành mục 2...),Toàn bộ danh sách bị xóa,Máy tính báo lỗi,B,Thông hiểu,Tin 8 - Chủ đề E2 - Bài 3
K8E2_B3_10,E2_Soan_thao_nang_cao,Em đang soạn thảo quy trình "Các bước luộc rau". Em nên chọn định dạng danh sách nào là phù hợp nhất?,Bullets (Dấu chấm),Numbering (1. 2. 3.),Không dùng danh sách,Dùng chữ in nghiêng,B,Vận dụng,Tin 8 - Chủ đề E2 - Bài 3
K8E2_B3_11,E2_Soan_thao_nang_cao,Em muốn chèn Logo trường vào góc trên cùng của TẤT CẢ các trang tài liệu. Cách nhanh nhất là gì?,Chèn ảnh Logo vào từng trang một,Chèn ảnh Logo vào phần Header (Đầu trang),Chèn ảnh Logo vào trang cuối cùng,Vẽ Logo bằng tay lên màn hình,B,Vận dụng,Tin 8 - Chủ đề E2 - Bài 3
K8E2_B3_12,E2_Soan_thao_nang_cao,Để tạo danh sách 2 cấp (ví dụ: 1. Phần mở bài -> a. Giới thiệu...), sau khi gõ xong mục 1, xuống dòng em nhấn phím nào để thụt lề vào tạo cấp con?,Phím Backspace,Phím Tab,Phím Enter,Phím Esc,B,Vận dụng,Tin 8 - Chủ đề E2 - Bài 3
q_id,topic_id,question_text,option_A,option_B,option_C,option_D,correct_option,difficulty,source
K8E2_B6_01,E2_Thuc_hanh_phan_cap,Tính năng "Multilevel List" trong Word dùng để làm gì?,Tạo danh sách liệt kê nhiều cấp độ (ví dụ 1. -> 1.1 -> 1.1.1),Tạo bảng biểu,Chèn công thức toán học,Kiểm tra lỗi chính tả,A,Nhận biết,Tin 8 - Chủ đề E2 - Bài 6
K8E2_B6_02,E2_Thuc_hanh_phan_cap,Để thay đổi cấp độ (Level) của một mục trong danh sách đa cấp, ta có thể dùng nút lệnh nào?,Bold / Italic,Increase Indent (Thụt lề) / Decrease Indent (Giảm thụt lề),Copy / Paste,Find / Replace,B,Nhận biết,Tin 8 - Chủ đề E2 - Bài 6
K8E2_B6_03,E2_Thuc_hanh_phan_cap,Mục lục tự động (Table of Contents) thường được tạo dựa trên yếu tố nào của văn bản?,Dựa trên màu sắc chữ,Dựa trên các kiểu Styles (Heading 1 Heading 2...) đã áp dụng cho tiêu đề,Dựa trên số lượng từ,Dựa trên hình ảnh,B,Nhận biết,Tin 8 - Chủ đề E2 - Bài 6
K8E2_B6_04,E2_Thuc_hanh_phan_cap,Để cập nhật lại số trang trong mục lục sau khi chỉnh sửa văn bản, ta nhấn chuột phải vào mục lục và chọn lệnh gì?,Delete Table,Update Field (Update Table),Edit Field,Format Table,B,Nhận biết,Tin 8 - Chủ đề E2 - Bài 6
K8E2_B6_05,E2_Thuc_hanh_phan_cap,Phím tắt nào giúp hạ cấp độ (thụt vào trong) của một mục trong danh sách đa cấp?,Shift + Tab,Tab,Ctrl + C,Alt + F4,B,Nhận biết,Tin 8 - Chủ đề E2 - Bài 6
K8E2_B6_06,E2_Thuc_hanh_phan_cap,Lợi ích của việc sử dụng Styles (Heading) kết hợp với Multilevel List là gì?,Chỉ để tô màu chữ,Giúp văn bản có cấu trúc rõ ràng thống nhất và hỗ trợ tạo mục lục tự động nhanh chóng,Làm văn bản khó đọc hơn,Không có lợi ích gì,B,Thông hiểu,Tin 8 - Chủ đề E2 - Bài 6
K8E2_B6_07,E2_Thuc_hanh_phan_cap,Trong cấu trúc phân cấp, Heading 1 thường dùng cho nội dung nào?,Nội dung chi tiết của đoạn văn,Tên chương hoặc tiêu đề lớn nhất,Chú thích hình ảnh,Tiêu đề phụ nhỏ nhất,B,Thông hiểu,Tin 8 - Chủ đề E2 - Bài 6
K8E2_B6_08,E2_Thuc_hanh_phan_cap,Tại sao khi làm báo cáo dài (như tiểu luận) ta bắt buộc phải dùng Mục lục tự động thay vì gõ tay?,Vì gõ tay rất lâu và khi số trang thay đổi ta phải dò lại từng mục để sửa rất dễ sai sót,Vì mục lục tự động có màu đẹp hơn,Vì giáo viên yêu cầu,Vì máy tính không cho gõ tay,A,Thông hiểu,Tin 8 - Chủ đề E2 - Bài 6
K8E2_B6_09,E2_Thuc_hanh_phan_cap,Nếu em muốn mục "1.1. Các loại máy tính" trở thành mục lớn "2. Các loại máy tính" (nâng cấp độ lên), em cần làm gì?,Nhấn phím Tab,Nhấn phím Shift + Tab (hoặc nút Decrease Indent),Xóa đi gõ lại,Nhấn phím Enter,B,Thông hiểu,Tin 8 - Chủ đề E2 - Bài 6
K8E2_B6_10,E2_Thuc_hanh_phan_cap,Em đang làm báo cáo, sau khi chèn thêm 5 trang nội dung vào giữa bài, số trang trong mục lục bị sai. Em xử lí thế nào?,Gõ lại số trang mới bằng tay vào mục lục,Xóa mục lục đi làm lại từ đầu,Nhấn chuột phải vào mục lục chọn Update Field > Update page numbers only,Mặc kệ nó,C,Vận dụng,Tin 8 - Chủ đề E2 - Bài 6
K8E2_B6_11,E2_Thuc_hanh_phan_cap,Để định dạng nhanh toàn bộ các tiêu đề chương trong văn bản theo cùng một kiểu (Font 14, Đậm, Xanh), cách chuyên nghiệp nhất là gì?,Chọn từng dòng tiêu đề và chỉnh thủ công,Sửa định dạng của Style "Heading 1" (Modify Style) và áp dụng Style này cho các tiêu đề,Dùng công cụ chổi sơn (Format Painter) quét từng cái,Không cần định dạng,B,Vận dụng,Tin 8 - Chủ đề E2 - Bài 6
K8E2_B6_12,E2_Thuc_hanh_phan_cap,Khi đang ở mục "1.2. Thân bài", em nhấn Enter để xuống dòng tạo mục mới, Word tự động sinh ra số nào?,1.3.,2.,a.,1.2.1.,A,Vận dụng,Tin 8 - Chủ đề E2 - Bài 6
q_id,topic_id,question_text,option_A,option_B,option_C,option_D,correct_option,difficulty,source
K8E2_B8_01,E2_Thuc_hanh_trinh_chieu,Để chèn một trang chiếu mới (New Slide) trong PowerPoint, ta dùng phím tắt nào?,Ctrl + N,Ctrl + M,Ctrl + S,Ctrl + P,B,Nhận biết,Tin 8 - Chủ đề E2 - Bài 8
K8E2_B8_02,E2_Thuc_hanh_trinh_chieu,Bố cục (Layout) phổ biến của trang tiêu đề (Title Slide) thường gồm những gì?,Chỉ có một khung văn bản lớn,Một khung tiêu đề chính và một khung tiêu đề phụ,Hai cột nội dung so sánh,Chỉ có hình ảnh,B,Nhận biết,Tin 8 - Chủ đề E2 - Bài 8
K8E2_B8_03,E2_Thuc_hanh_trinh_chieu,Để sao chép nội dung văn bản từ Word sang PowerPoint, ta dùng cặp lệnh nào?,Cut và Paste,Copy và Paste,Insert và Object,Import và Export,B,Nhận biết,Tin 8 - Chủ đề E2 - Bài 8
K8E2_B8_04,E2_Thuc_hanh_trinh_chieu,Chế độ hiển thị nào giúp ta quan sát tổng thể và sắp xếp lại thứ tự các trang chiếu dễ dàng nhất?,Normal View,Slide Sorter View,Reading View,Slide Show,B,Nhận biết,Tin 8 - Chủ đề E2 - Bài 8
K8E2_B8_05,E2_Thuc_hanh_trinh_chieu,Để trình chiếu bài thuyết trình từ trang đầu tiên, ta nhấn phím nào?,F1,F5,Esc,Ctrl + F5,B,Nhận biết,Tin 8 - Chủ đề E2 - Bài 8
K8E2_B8_06,E2_Thuc_hanh_trinh_chieu,Nguyên tắc "6x6" hoặc "7x7" trong thiết kế trang chiếu khuyên điều gì?,Mỗi trang chiếu nên có 6-7 hình ảnh,Mỗi trang nên có tối đa 6-7 dòng chữ và mỗi dòng 6-7 từ (ngắn gọn),Mỗi trang chiếu phải trình bày trong 6-7 phút,Phông chữ phải cỡ 6 hoặc 7,B,Thông hiểu,Tin 8 - Chủ đề E2 - Bài 8
K8E2_B8_07,E2_Thuc_hanh_trinh_chieu,Tại sao không nên sao chép nguyên văn cả một đoạn văn dài từ Word vào PowerPoint?,Vì PowerPoint không chứa được nhiều chữ,Vì quá nhiều chữ sẽ làm khán giả khó đọc và nhàm chán (slide cần tóm tắt ý chính),Vì sẽ bị lỗi phông chữ,Vì tốn dung lượng,B,Thông hiểu,Tin 8 - Chủ đề E2 - Bài 8
K8E2_B8_08,E2_Thuc_hanh_trinh_chieu,Khi chèn hình ảnh minh họa vào bài trình chiếu, cần lưu ý điều gì?,Hình ảnh phải thật nhỏ để tiết kiệm chỗ,Hình ảnh phải phù hợp với nội dung rõ nét và không bị méo,Nên chèn càng nhiều ảnh càng tốt,Chỉ dùng ảnh đen trắng,B,Thông hiểu,Tin 8 - Chủ đề E2 - Bài 8
K8E2_B8_09,E2_Thuc_hanh_trinh_chieu,Tính năng "Duplicate Slide" (Nhân đôi trang chiếu) hữu ích trong trường hợp nào?,Khi muốn xóa trang chiếu,Khi muốn tạo một trang chiếu mới có bố cục và nội dung gần giống trang cũ để sửa lại cho nhanh,Khi muốn tắt máy,Khi muốn chèn nhạc,B,Thông hiểu,Tin 8 - Chủ đề E2 - Bài 8
K8E2_B8_10,E2_Thuc_hanh_trinh_chieu,Bạn Nam đã soạn dàn ý chi tiết trên Word. Để chuyển nhanh dàn ý này thành các slide trong PowerPoint (mỗi Heading 1 là một slide mới), bạn ấy nên dùng tính năng nào?,Copy Paste từng đoạn,Slides from Outline (trong menu New Slide),Gõ lại từ đầu,Chụp ảnh màn hình Word dán vào,B,Vận dụng,Tin 8 - Chủ đề E2 - Bài 8
K8E2_B8_11,E2_Thuc_hanh_trinh_chieu,Một trang chiếu của em có nền màu xanh đậm (Dark Blue). Em nên chọn màu chữ nào để dễ đọc nhất?,Màu đen,Màu đỏ đậm,Màu trắng hoặc vàng sáng (tương phản cao),Màu xám tối,C,Vận dụng,Tin 8 - Chủ đề E2 - Bài 8
K8E2_B8_12,E2_Thuc_hanh_trinh_chieu,Trong bài thực hành giới thiệu "Danh lam thắng cảnh quê hương", trang kết thúc (Slide cuối) nên chứa nội dung gì?,Nội dung chi tiết về lịch sử,Lời cảm ơn và thông tin liên hệ/hỏi đáp,Để trống không ghi gì,Mục lục,B,Vận dụng,Tin 8 - Chủ đề E2 - Bài 8
